reviewId,userName,userImage,content,score,thumbsUpCount,reviewCreatedVersion,at,replyContent,repliedAt,appVersion
a8484922-c2ba-45fa-9dff-40713aa99060,Alga Wahyu Aditya,https://play-lh.googleusercontent.com/a-/ALV-UjUlRhPclHA69OOI1XnsNwzH5idzCqaIY7ic3le8hSM8aI0,"Sebenarnya sudah bagus, sayang fitur seperti hastag masih belum tersedia, semoga diupdate terbaru mas Mark Zuckerberg nambahin banyak fitur keren.",4,2,299.0.0.34.109,2023-09-12 20:04:50,,,299.0.0.34.109
d7e10b2e-29e6-4c6a-9a1f-6519c44ff8ad,Naseru 12,https://play-lh.googleusercontent.com/a-/ALV-UjU8oAuShYXQckQ9s3bUanXW-0usIeof6YRnGD3N6HEoEYU,"Threads gk ramah kayak dulu, padahal baru buka, tpi yg lewat cewek2 yg pada ngeliatin aurat nya, ni apk lama kayak fb co, mending ni apk di setting buat tulisan aja, gk usah ada upload2 gambar video segala, jadi kayak note aja",1,2,299.0.0.34.109,2023-09-12 15:41:35,,,299.0.0.34.109
11cb243c-55a6-4f2a-8ffd-666b47e9de93,Santi Yunitasari,https://play-lh.googleusercontent.com/a/ACg8ocKL64T64yP368y6XgY1t8X82qg36wKubejdsFNfv68X9w=mo,"Aplikasi nya gak bisa dibuka , cuman bisa liat beranda doang, dari cari, aktivitas sama akun gak bisa diliat, muncul tulisan ""Maaf, ada masalah. Coba lagi"" Sudah di uninstal masih aja gk bisa",1,2,299.0.0.34.109,2023-09-09 14:59:06,,,299.0.0.34.109
52b865fc-9ebd-447b-a228-034df90ef5f4,Hadi Santoso,https://play-lh.googleusercontent.com/a-/ALV-UjWHZzlW14U7Y4O8IVLCVMlzVTZ98EoO-tlYN7QgYPWv1w,Tambahin fitur translet bahasa dong. Bagi saya yang tidak mengerti bahasa asing untuk menikmati utasan orang lain yg pakai bahasa asing jadi tidak bisa! Nanti setelah ada fitur translet saya akan mengedit ulasan saya menjadi bintang 5. Mantap sudah di tambahan fitur nya⭐⭐⭐⭐⭐,5,1,293.0.0.30.110,2023-08-05 21:55:21,,,293.0.0.30.110
918ce327-2873-40ce-89b1-4f8ff4ebcb8e,Kelvin Hxw,https://play-lh.googleusercontent.com/a-/ALV-UjVnI2X97c_4mD5uziFQc6vy--ixFxOPa8f6G3Jv4X5LnMY,"Saat memutar video, suara selalu mati, tolong sediakan settingan agar bisa selalu dibuka, agar tidak perlu buka suara satu2 videonya",3,4,294.0.0.27.110,2023-08-03 05:38:28,,,294.0.0.27.110
